title,text
Sheep of the Big Horn,"
Come.  Go with me
don't worry
I know where
I'm going
Surely sure-footed
tall and strong
for the heights
Climb high with me
see over the rim
I live in the heights
come go with me
there are places unknown
Never seen, never shown
terrain so steep
No feet can keep
Take in the air
cold crisp
fresh and clean
Wind winding where
ever you step
ever you go
Here - there is a life to be
privileged to know
Come. Go with me.
to a higher ground



              Copyright ©: 
                    Copyright: nadyne d. claire        


"
Silent Forest ,"
Today amid the thick forest,
I am here again on the high mound,
The central seat to administer
The cattle left loose around. 
It is the same peak where we all
In the days of my childhood sat,
The reverend shepherds rested
Gossiped about the olden times
Narrated they life long experience,
And some twisted the fibers of jute
On the rotators to make cots. 
Different noises of life gurgled
From all sides around,
The goats bleated, the hounds barked,
The sheep moved lazily after being fed,
The camels ate tassels of the trees
The donkeys brayed at the noon,
The bulls fought entangling horns,
The birds chirped in the shadowy branches. 
Here are the patches where the old women
Of the village came to scythe grass green,
I see my mother too, carrying the stuffed sack,
Going back to home in the long queue. 
At noon the damsels or the elderly ladies
Of the village brought our lunch
With pickle, or onions or sugar
Home baked bread smeared with butter,
And milk in the earthen pots. 
We all excitedly waited for the moment,
Then gentle winds made us all sleepy,
We slept sweet sleep on the bare ground,
While the cattle sat, rested and chewed. 
When evening encroached, we measured
The stretched shadows with our feet
To know the time of return,
And we moved exhausted to homes
Behind the trails of surfeited lazy cattle. 
Ah! It is the same old forest
That often makes me nostalgic,
Melancholic memories begin to assemble
Forcing the tears to drop into dust. 
Sounds of life come from neither side,
The trees stood dressless like ghosts,
Or like bony skeletons that haunt in dreams,
As if flesh of nature has been eaten away
By the callous scavenger modernity. 
Now I being engrossed in the pensive mood
Hear nothing but the dirge of doleful silence
While air passes through stiff dry grass.            



              From: 
                    Muhammad Shanazar        


"
Socal Storm 2011,"
The ground exceeds saturation.
Owners drain backyard pools 
With rented pumps and hoses.
Dogs growl at raindrops.
Water spouts sighted off Newport.
Coastal roofs prepare for their beating.
Here’s the 3rd storm in a series of 4.
Huntington’s tornado lifted a houseboat.
Wind roars at the windows.
The screens rattle.
Neighborhood chimes ring like xylophones.
Palms and bamboo flutter most—
Leaves excite and shout
Like teenagers at a car wash.
Pines and oaks are mostly stoic;
Arms sway but spines remain
As true as iron.
Disneyland and Knotts threaten to close.
A plastic cup skids over asphalt.
Cats hunker down on blankets.
The mailman delivers mail fast,
Speeds the block like a demon.
The ice cream truck’s on hiatus.
It’s a good day for delivery pizza.
Sparrows dance in weeds and grass,
Rescue most of the drowning.



              From: 
                    Darcy Wright        






              Copyright ©: 
                    Kirby Wright        


"
Song,"
Oh! To be a flower
Nodding in the sun,
Bending, then upspringing
As the breezes run;
Holding up
A scent-brimmed cup,
Full of summer's fragrance to the summer sun.
Oh! To be a butterfly
Still, upon a flower,
Winking with its painted wings,
Happy in the hour.
Blossoms hold
Mines of gold
Deep within the farthest heart of each chaliced flower.
Oh! To be a cloud
Blowing through the blue,
Shadowing the mountains,
Rushing loudly through
Valleys deep
Where torrents keep
Always their plunging thunder and their misty arch of blue.
Oh! To be a wave
Splintering on the sand,
Drawing back, but leaving
Lingeringly the land.
Rainbow light
Flashes bright
Telling tales of coral caves half hid in yellow sand.
Soon they die, the flowers;
Insects live a day;
Clouds dissolve in showers;
Only waves at play
Last forever.
Shall endeavor
Make a sea of purpose mightier than we dream to-day?"
Speaking the Language of Deer,"
She heard a thumping sound behind her house,
turned on the back porch light to
a small herd of deer
startled by the suddenness of light, frozen
and indecisive as a letter of regret 
“don’t worry, it’s just me, I won’t harm you,”
she coaxed, a voice in light snowfall,
the deer, transfixed,
disbelieving in all things human
and unnatural
the darkness between, a division, an unsettling
of things beyond light and resolution,
assessing danger on the fly,
hindquarters enveloping into dark
slow as words,
determined as a Quaker weighting options
within the light, in silence
the woman in the household wondered
where they came from, which imaginary forest,
how they survived in the city
without encountering a car, how hooves
might feel on concrete after being in meadows,
why dark was a prevailing wind,
how their eyes remained after they were gone,
how her purse was genuine deerskin
how it fit everything in compartments
like she fit into apartments,
how she could still hear their refusal to stay



              From: 
                    Why Women Are A Ribbon Around A Bomb, Last Automat press, 2011        






              Copyright ©: 
                    2011, Martin Willitts Jr        


"
Stay,"
Stay,
        sighs the leaf
Stay,
         murmurs the branch
Stay,
          whispers the tree
          and learn to live like me



              Copyright ©: 
                    Julie Rutherford        


"
Strange Fruit,"
Southern trees bear a strange fruit,
Blood on the leaves and blood at the root,
Black body swinging in the Southern breeze,
Strange fruit hanging from the poplar trees.
Pastoral scene of the gallant South,
The bulging eyes and the twisted mouth,
Scent of magnolia sweet and fresh,
And the sudden smell of burning flesh!
Here is a fruit for the crows to pluck,
For the rain to gather, for the wind to suck,
For the sun to rot, for a tree to drop,
Here is a strange and bitter crop.



              Copyright ©: 
                    Abel Meeropol        


"
Summer,"
This glorious time of year
grace is in bloom, divine
supple spindles gleam
by golden beam
waltz, waltz June fairies
from dandelion to lofty pine.
Off on a stroll above meadows
scented wisps, a tryst, oh my
sandalwood, sweet
fair mulberry treat
swoon, swoon ethereal swans
into the mild, evening light, of July.
Stirring for summer's farewell
frail wonders, tulips, up high
butterflies pair
with delicate flair
steady, steady August delights
primroses await your slumbering sigh.



              From: 
                    Luther L. Seahand         






              Copyright ©: 
                    Luther L. Seahand        


"
Sun Light,"
From heavens it descends
in sweat yellowish rays
My mind is blown up by
the beauty it conveys
All look adorable
the trees the parks the highways
And I see the remarkable nature
that sums up the beauty of the night
It's the time of dawn
when we see the sun light
My soul that it takes away
such an astonishing sight
Summer afternoon at it's peak
rain after weak
And the sun shows up
what else do you need.



              From: 
                    Ammar Hussain        






              Copyright ©: 
                    Ammar Hussain        


"
Sunlight Through A Window,"
Beauty streamed into my hand
In sunlight through a pane of glass;
Now at last I understand
Why suns must pass.
I have held a shadow, cool
Reflection of a burning gold,
And it has been more beautiful
Than hands should hold.
To that delicate tracery
Of light, a force my lips must name
In whispers of uncertainty,
Has answered through me in a flame.
Beauty is the core of fire
To reaching hands; even its far
Passing leaves a hurt desire
Like a scar. "
Sunshine Left Behind,"
A band of pale gold
juxtaposed
on an inside wall
reflects the shadows
of flickering leaves
blown by a gentle breeze.
The glow outside
shrouds
shy pumpkin vines
emerging dimly
from the enveloping dark
cossetted inside a twilit sky.



              From: 
                    Ken W Simpson        


"
The Asparagus,"
She sent packs of great beasts to pass
Over him, trailing belly-fur and dust,
Bending their nostrils to his frail spear.
This was to toughen him. For what?
Stupidly, like a squirrel, standing up,
Looking here and there, looking to all sides,
He is cut down and taken away.
She can smell him steaming, his crowns
Already tender, his spine giving in.
Now he is threatening to wither terribly,
And slip from the water altogether,
And billow through the kitchen like prayer.



              From: 
                    1996,  The World At Large: New and Selected Poems        






              Copyright ©: 
                    The University of Chicago Press        


"
The Blackbird,"
How sweet the harmonies of afternoon:
The Blackbird sings along the sunny breeze
His ancient song of leaves, and summer boon;
Rich breath of hayfields streams through whispering trees;
And birds of morning trim their bustling wings,
And listen fondly - while the Blackbird sings.
How soft the lovelight of the West reposes
On this green valley's cheery solitude,
On the trim cottage with its screen of roses,
On the gray belfry with its ivy hood,
And murmuring mill-race, and the wheel that flings
Its bubbling freshness - while the Blackbird sings.
The very dial on the village church
Seems as 'twere dreaming in a dozy rest;
The scribbled benches underneath the porch
Bask in the kindly welcome of the West;
But the broad casements of the old Three Kings
Blaze like a furnace - while the Blackbird sings.
And there beneath the immemorial elm
Three rosy revellers round a table sit,
And through gray clouds give laws unto the realm,
Curse good and great, but worship their own wit.
And roar of fights, and fairs, and junketings,
Corn, colts, and curs - the while the Blackbird sings.
Before her home, in her accustomed seat,
The tidy Grandam spins beneath the shade
Of the old honeysuckle, at her feet
The dreaming pug, and purring tabby laid;
To her low chair a little maiden clings,
And spells in silence - while the Blackbird sings.
Sometimes the shadow of a lazy cloud
Breathes o'er the hamlet with its gardens green.
While the far fields with sunlight overflowed
Like golden shores of Fairyland are seen;
Again, the sunshine on the shadow springs,
And fires the thicket where the Blackbird sings.
The woods, the lawn, the peaked Manorhouse,
With its peach-covered walls, and rookery loud,
The trim, quaint garden alleys, screened with boughs.
The lion-headed gates, so grim and proud,
The mossy fountain with its murmurings,
Lie in warm sunshine - while the Blackbird sings.
The ring of silver voices, and the sheen
Of festal garments - and my Lady streams
With her gay court across the garden green;
Some laugh, and dance, some whisper their love-dreams;
And one calls for a little page; he strings
Her lute beside her - while the Blackbird sings.
A little while - and lo! the charm is heard,
A youth, whose life has been all Summer, steals
Forth from the noisy guests around the board,
Creeps by her softly; at her footstool kneels;
And, when she pauses, murmurs tender things
Into her fond ear - while the Blackbird sings.
The smoke-wreaths from the chimneys curl up higher,
And dizzy things of eve begin to float
Upon the light; the breeze begins to tire;
Half way to sunset with a drowsy note
The ancient clock from out the valley swings;
The Grandam nods - and still the Blackbird sings.
Far shouts and laughter from the farmstead peal,
Where the great stack is piling in the sun;
Through narrow gates o'erladen wagons reel,
And barking curs into the tumult run;
While the inconstant wind bears off, and brings
The merry tempest - and the Blackbird sings.
On the high wold the last look of the sun
Burns, like a beacon, over dale and stream;
The shouts have ceased, the laughter and the fun;
The Grandam sleeps, and peaceful be her dream;
Only a hammer on an anvil rings;
The day is dying - still the Blackbird sings.
Now the good Vicar passes from his gate
Serene, with long white hair; and in his eye
Burns the clear spirit that hath conquered Fate,
And felt the wings of immortality;
His heart is thronged with great imaginings,
And tender mercies - while the Blackbird sings.
Down by the brook he bends his steps, and through
A lowly wicket; and at last he stands
Awful beside the bed of one who grew
From boyhood with him - who, with lifted hands
And eyes, seems listening to far welcomings,
And sweeter music than the Blackbird sings.
Two golden stars, like tokens from the Blest,
Strike on his dim orbs from the setting sun;
His sinking hands seem pointing to the West;
He smiles as though he said - 'Thy will be done':
His eyes, they see not those illuminings;
His ears, they hear not what the Blackbird sings."
The Blackbird Of Derrycairn,"
Stop, stop and listen for the bough top
Is whistling and the sun is brighter
Than God's own shadow in the cup now!
Forget the hour-bell. Mournful matins
Will sound, Patric, as well at nightfall.
Faintly through mist of broken water
Fionn heard my melody in Norway.
He found the forest track, he brought back
This beak to gild the branch and tell, there,
Why men must welcome in the daylight.
He loved the breeze that warns the black grouse,
The shouts of gillies in the morning
When packs are counted and the swans cloud
Loch Erne, but more than all those voices
My throat rejoicing from the hawthorn.
In little cells behind a cashel,
Patric, no handbell gives a glad sound.
But knowledge is found among the branches.
Listen! That song that shakes my feathers
Will thong the leather of your satchels."
The calamities,"
Calamities are the beasts of prey,
They hide couching along the route of life,
And pounce on the each passerby,
When he enters into their hunting range,
Who knows who becomes the victim,
And where they prey upon him,
With the nailed paws and tearing jaws.



              From: 
                    Shahida Latif        


"
The Cattle Egret,"
he struts across
the plaza parking lot
like he was mr. universe
proud as hell to
be the cattle egret
that he is
his appearance is
flawless except for
the perpetual grease spots
on his back from slipping
under parked cars looking
for bugs and lizards to eat
this is his fourth winter here
and i feel compelled to
name him something
charlie seems to suit him
though he won't to this day
answer to anything he's called 



              Copyright ©: 
                    Faith Elizabeth Brigham        


"
The Chestnut Casts His Flambeaux,"
The chestnut casts his flambeaux, and the flowers
Stream from the hawthorn on the wind away,
The doors clap to, the pane is blind with showers.
Pass me the can, lad; there's an end of May.
There's one spoilt spring to scant our mortal lot,
One season ruined of your little store.
May will be fine next year as like as not:
But ay, but then we shall be twenty-four.
We for a certainty are not the first
Have sat in taverns while the tempest hurled
Their hopeful plans to emptiness, and cursed
Whatever brute and blackguard made the world.
It is in truth iniquity on high
To cheat our sentenced souls of aught they crave,
And mar the merriment as you and I
Fare on our long fool's-errand to the grave.
Iniquity it is; but pass the can.
My lad, no pair of kings our mothers bore;
Our only portion is the estate of man:
We want the moon, but we shall get no more.
If here to-day the cloud of thunder lours
To-morrow it will hie on far behests;
The flesh will grieve on other bones than ours
Soon, and the soul will mourn in other breasts.
The troubles of our proud and angry dust
Are from eternity, and shall not fail.
Bear them we can, and if we can we must.
Shoulder the sky, my lad, and drink your ale."
The Conference of The Birds,"
Now the birds are warming to their task,
Their spirits are moving now like the ocean swell.
Love for the Simurgh is born in those who ask
Themselves if they could tread the path, they tell
Each other they are ready to journey to the light
But first they seek a guide who will lead
And parse anguish and joy throughout their flight.
They swear fidelity to the guide in thought and deed
Be it pleasant or be it filled with pain, as long
As they can pledge themselves to the King, this throng
Of pilgrims dark and fair, are prepared to don
   angels' wings"
The Crossed Apple,"
I've come to give you fruit from out my orchard,
Of wide report.
I have trees there that bear me many apples.
Of every sort:
Clear, streaked; red and russet; green and golden;

Sour and sweet.
This apple's from a tree yet unbeholden,
Where two kinds meet,—
So that this side is red without a dapple,

And this side's hue
Is clear and snowy. It's a lovely apple.
It is for you.
Within are five black pips as big as peas,

As you will find,
Potent to breed you five great apple trees
Of varying kind:
To breed you wood for fire, leaves for shade,

Apples for sauce.
Oh, this is a good apple for a maid,
It is a cross,
Fine on the finer, so the flesh is tight,

And grained like silk.
Sweet Burning gave the red side, and the white
Is Meadow Milk.
Eat it, and you will taste more than the fruit:

The blossom, too,
The sun, the air, the darkness at the root,
The rain, the dew,
The earth we came to, and the time we flee,

The fire and the breast.
I claim the white part, maiden, that's for me.
You take the rest."
The Earth Smiles Back,"
Standing on the rocky shore,
waves crash into the bay,
The sandy beaches glimmer in
the newness of the day.
Wandering the shoreline,
a sound from far away,
The forest echoes with the sound,
of a blackbird or a jay. 
Discovering a tree-lined path,
it seems the perfect day,
To walk a trail I never knew,
and get some time away. 
Breathing in the evergreen,
convinces me to stay,
So I sit a bit to watch
the leaves and branches play. 
Sitting still among the trees,
and all the shades of green,
I smile as I marvel at
these sights I've never seen 
Streams of light shine through just right,
Pillars of sunshine, immensely bright,
I can't be sure but it seems to be,
the earth is smiling back at me.



              Copyright ©: 
                    Alyssa Murray        


"
The Earth's Breath,"
The Earth’s Breath is
The kissing reds of rose beds;
Is the blue jay’s lift and curl
In a bush- and sun-spread day;
Is the lake’s changeling face
Turned silver by the moon’s reflection;
Is the soft-caught cedar tree
Aged, flecked with snow.
The Earth’s Breath is
A monument unto itself;
Is ebb and flow and
Life, death, rebirth;
Is both erasure
And remembrance.
The Earth’s Breath is
What makes one ask:
What is the Earth’s Breath?
?



              From: 
                    Bryan Damien Nichols        






              Copyright ©: 
                    Bryan Damien Nichols        


"
The Epic Menageries ,"
Clouds shape less pleasing,
They’re darkness eclipses
Heaven’s holes to mock the sun;
And the sky gives feeling
Like the world’s going to change
For better or worse;
Their values remain written,
Encrypted in clouds too
Baggy to keep rain;
Choices thunder like hoofs
That beat to sixteen counts
As you listen hard;
So you watch them leave drops
Of rain bits in hazy skies;
While you wait for the
Apocalypse and forget
The world promised to change
For better or naught;
And then you prayed,
And soon you knelt,
When it rained hard and
God then played cards that
They all were dealt;
You went at it again
And kept pounding the waves,
You laughed at the winds
And the trees that fell
As you tried to be brave;
Clouds shape pleasing, they
Drift existentially;
Past eyes held open
Wide for pies and horse’s hoofs
That prick the sky so that
You’ll question your worth.



              Copyright ©: 
                    2013        


"
The Fraser River,"
 unlike the far more famous nile
    surging ahead with sweat of old africa
or the much mightier huanghe
    bursting with torrential tears of all china
from glamorous glaciers deep in the rockies
  you are perfectly pure to breasfeed my vancouver
 	the super sweetheart of north america
(aug.30, 2004)



              From: 
                    Vancouver        






              Copyright ©: 
                    Mike Yuan        


"
The Glory of Nature,"
IF only once the chariot of the Morn
    Had scatter'd from its wheels the twilight dun,
    But once the unimaginable Sun
Flash'd godlike thro' perennial clouds forlorn,
And shown us Beauty for a moment born;
If only once blind eyes had seen the Spring,
    Waking amid the triumphs of midnoon;
    But once had seen the lovely Summer boon
Pass by in state like a full-robed King,
The waters dance, the woodlands laugh and sing;
If only once deaf ears had heard the joy
    Of the wild birds, or morning breezes blowing,
    Or silver fountains from their caverns flowing,
Or the deep-voiced rivers rolling by;
Then Night eternal fallen from the sky;
If only once weird Time had rent asunder
    The curtain of the Clouds, and shown us Night
    Climbing into the awful Infinite
Those stairs whose steps are worlds, above and under,
Glory on glory, wonder upon wonder!
The Lightnings lit the Earthquake on his way;
    The sovran Thunder spoken to the World;
    The realm-wide banners of the Wind unfurl'd;
Earth-prison'd Fires broke loose into the day;
Or the great Seas awoke -- then slept for aye!
Ah! sure the heart of Man, too strongly tried
    By Godlike Presences so vast and fair,
    Withering with dread, or sick with love's despair,
Had wept for ever, and to Heaven cried,
Or struck with lightnings of delight had died.
But He, though heir of Immortality,
    With mortal dust too feeble for the sight,
    Draws thro' a veil God's overwhelming light;
Use arms the Soul -- anon there moveth by
A more majestic Angel -- and we die! "
The Green Bowl,"
This little bowl is like a mossy pool
In a Spring wood, where dogtooth violets grow
Nodding in chequered sunshine of the trees;
A quiet place, still, with the sound of birds,
Where, though unseen, is heard the endless song
And murmur of the never resting sea.
'T was winter, Roger, when you made this cup,
But coming Spring guided your eager hand
And round the edge you fashioned young green leaves,
A proper chalice made to hold the shy
And little flowers of the woods. And here
They will forget their sad uprooting, lost
In pleasure that this circle of bright leaves
Should be their setting; once more they will dream
They hear winds wandering through lofty trees
And see the sun smiling between the leaves."
The Hawthorn Tree,"
Across the shimmering meadows--
Ah, when he came to me!
In the spring-time,
In the night-time,
In the starlight,
Beneath the hawthorn tree.
Up from the misty marsh-land--
Ah, when he climbed to me!
To my white bower,
To my sweet rest,
To my warm breast,
Beneath the hawthorn tree.
Ask of me what the birds sang,
High in the hawthorn tree;
What the breeze tells,
What the rose smells,
What the stars shine--
Not what he said to me!"
The Little Garden,"
A little garden on a bleak hillside
Where deep the heavy, dazzling mountain snow
Lies far into the spring. The sun's pale glow
Is scarcely able to melt patches wide
About the single rose bush. All denied
Of nature's tender ministries. But no, --
For wonder-working faith has made it blow
With flowers many hued and starry-eyed.
Here sleeps the sun long, idle summer hours;
Here butterflies and bees fare far to rove
Amid the crumpled leaves of poppy flowers;
Here four o'clocks, to the passionate night above
Fling whiffs of perfume, like pale incense showers.
A little garden, loved with a great love!"
The Magic,"
Tell me O gardener, what is this magic
Of branches gloomy and naked yesterday,
Yet bearing magnificent blooms today!
Watch the arms bearing heavenly buds
With petals divine, mystic and vibrant
Being offered to the blues of distant skies!
O gardener, whisper onto my ears deep,
The magic of these majestic blossoms,
To be withered onto the dusty earth! 



              From: 
                    Preeth Nambiar        






              Copyright ©: 
                    Preeth Nambiar        


"
